{
  "$schema": "./rules.schema.json",
  "methodology": "DFC Bridge",
  "version": "0.5.0",
  "severityLevels": [
    "error",
    "warning",
    "info"
  ],
  "automationLevels": [
    "automatic",
    "heuristic",
    "manual"
  ],
  "rules": [
    {
      "id": "identity.missing-stable-identity",
      "principle": "Identity",
      "severity": "error",
      "automation": "automatic",
      "description": "Important transferable elements, including decorative and asset roots, must have a stable identity: a stable layer name or an identity-bearing fallback tag value.",
      "fix": "Use an English kebab-case layer name when Figma metadata provides the type. Boolean `[decor]` and `[asset]` are visual-intent/policy flags and are not enough by themselves to identify a poorly named layer."
    },
    {
      "id": "identity.duplicate-identity",
      "principle": "Identity",
      "severity": "error",
      "automation": "automatic",
      "description": "Two elements inside the same declared audit context—such as one page breakpoint/view or one selected-section variant—must not share one stable design identity.",
      "fix": "Prefer semantic fixture keys that survive reordering, such as `product-card-sku-blue`; use positional indexes such as `product-card-1` only as a design-fixture fallback. Never treat a positional suffix as a runtime data key."
    },
    {
      "id": "identity.same-identity-different-type",
      "principle": "Identity",
      "severity": "error",
      "automation": "automatic",
      "description": "The same identity must not resolve to different logical element types across comparable declared responsive contexts, including explicitly selected variants of one section.",
      "fix": "Keep the Figma node/component type stable across the declared contexts or model a separate entity. Do not invent page or breakpoint tags on a selected section."
    },
    {
      "id": "identity.breakpoint-specific-id",
      "principle": "Identity",
      "severity": "error",
      "automation": "automatic",
      "description": "Optional DFC Bridge identity values must describe logical elements, not responsive breakpoints. A value such as `[control=button-reviews-box-375]` inside a `[bp=375]` root is invalid when the suffix matches the current breakpoint.",
      "fix": "Remove the breakpoint suffix from the optional id. For ordinary buttons/controls, remove the optional id completely and use `Отзывы мобилка [action=modal:marketplaces-modal]`."
    },
    {
      "id": "identity.repeated-item-no-index",
      "principle": "Identity",
      "severity": "error",
      "automation": "heuristic",
      "description": "Authored repeated list or grid occurrences need distinct stable design-instance anchors. `[item=...]` only classifies their shared repeated role or type; it is not an instance identity.",
      "fix": "Give each occurrence a meaningful stable layer or design-instance key, such as `product-card-oak-chair` and `product-card-wool-lamp`, while both may use `[item=product-card]`. Use numeric fixture suffixes only as a fallback, never as runtime-data identity."
    },
    {
      "id": "identity.multiple-identity-tags",
      "principle": "Identity",
      "severity": "warning",
      "automation": "automatic",
      "description": "One layer must not declare multiple competing identity tags such as `[section=...]` and `[modal=...]`.",
      "fix": "Keep the one tag that represents the layer's logical identity. Express behavior and visual intent with non-identity tags such as `[href=...]`, `[action=...]`, `[decor]`, or `[asset]`."
    },
    {
      "id": "syntax.decor-asset-value-not-kebab-case",
      "principle": "Roles",
      "severity": "error",
      "automation": "automatic",
      "description": "Boolean `[decor]` and `[asset]` are valid without values. If a fallback value is present in `[decor=...]` or `[asset=...]`, it must be English kebab-case.",
      "fix": "Prefer a stable layer identity plus boolean flags, for example `sneg [decor] [asset]`. Use value form only for poor/default layer names, for example `Frame 182 [decor=snow-bg]`."
    },
    {
      "id": "syntax.identity-value-not-kebab-case",
      "principle": "Identity",
      "severity": "warning",
      "automation": "automatic",
      "description": "Authored identity-like tag values, anchors, and views should use stable English kebab-case so validators and adapters can compare them deterministically.",
      "fix": "Replace spaces, localized words, uppercase characters, and punctuation with a stable English kebab-case value such as `product-card-1`, `contact-modal`, `faq`, or `not-found`."
    },
    {
      "id": "identity.decor-asset-flags-not-identities",
      "principle": "Identity",
      "severity": "error",
      "automation": "automatic",
      "description": "`[decor]` and `[asset]` are visual-intent/policy flags and must not be counted as identity tags or as multiple identities when they appear together.",
      "fix": "Resolve identity from the stable layer name such as `sneg`; keep `[decor]` and `[asset]` as flags. Use `[decor=...]` or `[asset=...]` only as fallback for poor/default layer names."
    },
    {
      "id": "syntax.duplicate-tag",
      "principle": "Roles",
      "severity": "error",
      "automation": "automatic",
      "description": "A layer must not repeat the same DFC Bridge tag key.",
      "fix": "Keep one canonical value for the key. If two values describe different concerns, model them with the appropriate distinct tags or split the logical entities."
    },
    {
      "id": "syntax.figma-metadata-tag-invalid",
      "principle": "Roles",
      "severity": "error",
      "automation": "automatic",
      "description": "Tags derived from native Figma metadata, including `[text]`, `[image]`, `[icon]`, `[container]`, `[layout]`, `[abs]`, and `[component]`, must not be authored in layer names.",
      "fix": "Remove the metadata tag and express the property through the native Figma node type, component source, layout mode, positioning, fills, or export settings."
    },
    {
      "id": "section.role-prefix-in-name",
      "principle": "Identity",
      "severity": "warning",
      "automation": "heuristic",
      "description": "Section layer names should not repeat the role with prefixes such as `Section /` or `Секция /`.",
      "fix": "Keep the human label concise. Resolve the section from the `Page Sections` source component when possible, or use `[section=...]` only for frame sections, generic components, or explicit overrides."
    },
    {
      "id": "section.identity-as-human-heading",
      "principle": "Identity",
      "severity": "warning",
      "automation": "heuristic",
      "description": "A section key should describe the reusable section component, not copy the page-specific heading.",
      "fix": "Use the layer name for the contextual heading. Resolve the stable section key from `Page Sections` or use `[section=...]` only when an explicit fallback/override is needed."
    },
    {
      "id": "section.component-source-unclassified",
      "principle": "Identity",
      "severity": "warning",
      "automation": "heuristic",
      "description": "A page-level section component instance should come from the `Page Sections` library page, or the layer should declare an explicit `[section=...]` fallback.",
      "fix": "Move the source component to `Page Sections`, register it as a section component, or add `[section=...]` only when the layer is a frame section, a generic component, or an explicit override."
    },
    {
      "id": "section.redundant-instance-section-tag",
      "principle": "Identity",
      "severity": "warning",
      "automation": "heuristic",
      "description": "Instances of components from `Page Sections` should not repeat `[section=...]` on the page layer.",
      "fix": "Remove the redundant page-layer `[section=...]`; resolve section id from the source component or component set name."
    },
    {
      "id": "component.ui-kit-used-as-section",
      "principle": "Roles",
      "severity": "warning",
      "automation": "heuristic",
      "description": "Components from `UI Kit` are ordinary interface components and should not be inferred as page sections.",
      "fix": "Use a component from `Page Sections` for a page-level section, or add `[section=...]` only for a deliberate frame section or override."
    },
    {
      "id": "naming.default-layer-name",
      "principle": "Roles",
      "severity": "warning",
      "automation": "heuristic",
      "description": "Default names such as `Frame 53` or `Group 271` usually hide missing structure or intent.",
      "fix": "Rename the layer with a stable English kebab-case identity; add DFC Bridge intent tags only where needed."
    },
    {
      "id": "layout.missing-role",
      "principle": "Roles",
      "severity": "error",
      "automation": "automatic",
      "description": "Every layer must be classifiable from Figma metadata or DFC Bridge intent tags.",
      "fix": "Fix the Figma structure/metadata first; add DFC Bridge tags only for product or transfer intent such as `[section=...]`, `[href=...]`, `[link]`, `[action=...]`, `[control]`, `[field=...]`, `[decor]`, `[asset]`, `[modal=...]`, or `[state=...]`."
    },
    {
      "id": "layout.page-root-missing-auto-layout",
      "principle": "Geometry",
      "severity": "error",
      "automation": "automatic",
      "description": "Every DFC Bridge page root must use native Figma Auto Layout, even when it has zero or one child. A page root is a responsive content container, not primitive or leaf geometry, and cannot mark itself `[asset]` to bypass the rule.",
      "fix": "Enable vertical, horizontal, or grid Auto Layout on the page root and define its padding, gap, alignment, and wrapping in Figma. `[asset]`, `[decor]`, absolute positioning, and an exception tag on the page root do not suppress this blocking finding."
    },